{
  "schemaVersion": 1,
  "accountAlias": "account-example",
  "deviceAlias": "device-example",
  "deviceGroup": "account-example-research",
  "phase": "topic_learning",
  "primaryTopic": "夏季通勤穿搭",
  "topicPool": ["夏季通勤穿搭", "通勤鞋"],
  "automationPolicy": "research_read_only",
  "interactionPolicy": "human_final",
  "paused": false,
  "phaseApproval": {
    "phase": "topic_learning",
    "approved": true,
    "approvedAt": "2026-07-14T00:00:00+08:00"
  }
}
